item,preço
Leite Longa Vida Piracanjuba Integral Com Tampa 1l,"R$ 3,05"
Leite Longa Vida Jussara 1l Com Tampa Integral,"R$ 3,38"
Leite Longa Vida Nestle 1l Ninho Edge,"R$ 4,48"
Leite Longa Vida Italac Desnatado 1l,"R$ 3,05"
Leite Longa Vida Italac Sem Lactose Semi Desnat Com Tampa 1l,"R$ 3,98"
Leite Pasteurizado Letti 1l Garrafa Tipo A,"R$ 6,39"
Leite Longa Vida Italac Desnatado Com Tampa 1l,"R$ 3,18"
Leite Pasteurizado Letti 1l Garrafa Magro,"R$ 6,39"
Leite Longa Vida Parmalat 1l Integral Com Tampa,"R$ 3,28"
Leite Longa Vida Nestle 1l Molico Edge,"R$ 3,98"
Leite Longa Vida Nestle 1l Ninho Levinho Edge,"R$ 3,98"
Leite Longa Vida Jussara Sem Lactose Garrafa 1l,"R$ 3,75"
Leite Longa Vida Nilza Sem Lactose 1l,"R$ 3,98"
Leite Longa Vida Danone Integral Com Tampa 1l,"R$ 3,68"
Leite Pasteurizado Fazenda 1l Tipo A,"R$ 5,78"
Leite Lv Italac 1l Zero Lactose Integral,"R$ 3,98"
Leite Pasteur Xando Magro A 1l,"R$ 5,79"
Leite Po Ninho Integral 400g Forti+,"R$ 16,90"
Leite Pó Italac 400g Integral Sache,"R$ 10,90"
Leite Lv Parmalat Zymil 1l S/Lac In Integ,"R$ 4,28"
Leite Itambê Premium Integral Dez Vitaminas 1l,"R$ 4,19"
Leite Longa Vida Paulista Integral Com Tampa 1l,"R$ 3,58"
Leite Longa Vida Batavo Integral 1l,"R$ 3,58"
Leite Em Pó Itambé 400g Pacote Integral,"R$ 10,90"
Leite Pasteurizado Agrindus 1l Integral,"R$ 4,59"
Leite Longa Vida Batavo Semi Desnatado 1l,"R$ 3,58"
Leite Longa Vida Itambê Nolac Sem Lactose Semi Desnatado 1l,"R$ 4,19"
Leite Po Sem Lactose Supra Soy 300g Nature,"R$ 22,90"
Leite Longa Vida Piracanjuba Desnatado Com Tampa 1l,"R$ 3,05"
Leite Longa Vida Jussara Sem Lactose Integral 1l,"R$ 3,75"
Leite Cabra Capprys Integral 1l,"R$ 10,90"
Leite Longa Vida Paulista Semi Desnatado Com Tampa 1l,"R$ 3,58"
